{"$id":"https://vault-agent-memory.invalid/subject-distillation/environment.schema.json","$schema":"https://json-schema.org/draft/2020-12/schema","additionalProperties":false,"properties":{"artifact_kind":{"const":"subject-distillation-environment","type":"string"},"baseline_id":{"pattern":"^[0-9a-f]{16}$","type":"string"},"created_at_utc":{"pattern":"^[0-9]{4}-[0-9]{2}-[0-9]{2}T[0-9]{2}:[0-9]{2}:[0-9]{2}Z$","type":"string"},"git_status":{"additionalProperties":false,"properties":{"captured_phase":{"const":"pre_implementation","type":"string"},"clean":{"const":true,"type":"boolean"},"head_kind":{"enum":["branch","detached"],"type":"string"}},"required":["captured_phase","clean","head_kind"],"type":"object"},"implementation_authorization":{"additionalProperties":false,"properties":{"allowed_repo_relative_paths":{"items":{"pattern":"^[A-Za-z0-9][A-Za-z0-9._/-]{0,255}$","type":"string"},"maxItems":16,"minItems":16,"type":"array"},"artifact_kind":{"const":"subject-distillation-implementation-authorization-proof","type":"string"},"authorization_id":{"pattern":"^[0-9a-f]{64}$","type":"string"},"authorization_pass_packet_sha256":{"pattern":"^[0-9a-f]{64}$","type":"string"},"authorization_schema_sha256":{"pattern":"^[0-9a-f]{64}$","type":"string"},"authorization_verifier_sha256":{"pattern":"^[0-9a-f]{64}$","type":"string"},"authorized_task":{"const":"T-001","type":"string"},"authorizing_principal":{"const":"github:zycaskevin","type":"string"},"baseline_full_digest":{"pattern":"^[0-9a-f]{64}$","type":"string"},"baseline_id":{"pattern":"^[0-9a-f]{16}$","type":"string"},"expires_at_utc":{"pattern":"^[0-9]{4}-[0-9]{2}-[0-9]{2}T[0-9]{2}:[0-9]{2}:[0-9]{2}Z$","type":"string"},"implementation_base_commit":{"pattern":"^git:(?:[0-9a-f]{40}|[0-9a-f]{64})$","type":"string"},"issued_at_utc":{"pattern":"^[0-9]{4}-[0-9]{2}-[0-9]{2}T[0-9]{2}:[0-9]{2}:[0-9]{2}Z$","type":"string"},"non_goals":{"items":{"pattern":"^[a-z][a-z0-9._:-]{0,127}$","type":"string"},"maxItems":4,"minItems":4,"type":"array"},"owner_confirmation_ref":{"pattern":"^[A-Za-z0-9][A-Za-z0-9._:-]{0,127}$","type":"string"},"prohibited_operations":{"items":{"pattern":"^[a-z][a-z0-9_]{0,127}$","type":"string"},"maxItems":7,"minItems":7,"type":"array"},"proposal_id":{"pattern":"^[0-9a-f]{64}$","type":"string"},"receipt_sha256":{"pattern":"^[0-9a-f]{64}$","type":"string"},"recorded_at_utc":{"pattern":"^[0-9]{4}-[0-9]{2}-[0-9]{2}T[0-9]{2}:[0-9]{2}:[0-9]{2}Z$","type":"string"},"runner":{"additionalProperties":false,"properties":{"path":{"const":"scripts/run_subject_implementation_authorization.py","type":"string"},"sha256":{"pattern":"^[0-9a-f]{64}$","type":"string"}},"required":["path","sha256"],"type":"object"},"schema_version":{"const":1,"type":"integer"},"scope_sha256":{"pattern":"^[0-9a-f]{64}$","type":"string"},"status":{"const":"PASS","type":"string"}},"required":["schema_version","artifact_kind","status","authorized_task","implementation_base_commit","baseline_id","baseline_full_digest","authorizing_principal","allowed_repo_relative_paths","non_goals","prohibited_operations","issued_at_utc","expires_at_utc","recorded_at_utc","scope_sha256","receipt_sha256","authorization_verifier_sha256","authorization_schema_sha256","authorization_id","authorization_pass_packet_sha256","proposal_id","runner","owner_confirmation_ref"],"type":"object"},"normative_hashes":{"items":{"additionalProperties":false,"properties":{"path":{"pattern":"^[A-Za-z0-9][A-Za-z0-9._/-]{0,255}$","type":"string"},"sha256":{"pattern":"^[0-9a-f]{64}$","type":"string"}},"required":["path","sha256"],"type":"object"},"maxItems":5,"minItems":5,"type":"array"},"producer_task":{"const":"T-001","type":"string"},"python":{"additionalProperties":false,"properties":{"implementation":{"const":"CPython","type":"string"},"version":{"items":{"maximum":999,"minimum":0,"type":"integer"},"maxItems":3,"minItems":3,"type":"array"}},"required":["implementation","version"],"type":"object"},"schema_contract_version":{"maximum":65535,"minimum":0,"type":"integer"},"schema_version":{"const":1,"type":"integer"},"source_commit":{"pattern":"^git:(?:[0-9a-f]{40}|[0-9a-f]{64})$","type":"string"},"sqlite":{"additionalProperties":false,"properties":{"version":{"items":{"maximum":999,"minimum":0,"type":"integer"},"maxItems":3,"minItems":3,"type":"array"}},"required":["version"],"type":"object"}},"required":["schema_version","artifact_kind","baseline_id","source_commit","created_at_utc","producer_task","git_status","python","sqlite","schema_contract_version","normative_hashes","implementation_authorization"],"type":"object"}
