{"artifact_kind":"subject-distillation-environment","baseline_id":"5dd83dd8b3d3696a","created_at_utc":"2026-08-11T07:46:00Z","git_status":{"captured_phase":"pre_implementation","clean":true,"head_kind":"branch"},"implementation_authorization":{"allowed_repo_relative_paths":["scripts/read_subject_baseline_id.py","scripts/update_subject_progress.py","scripts/validate_subject_evidence.py","scripts/validate_subject_progress.py","specs/subject-distillation/.implementation-progress.pending","specs/subject-distillation/evidence-schemas/attestation.schema.json","specs/subject-distillation/evidence-schemas/backup-restore.schema.json","specs/subject-distillation/evidence-schemas/environment.schema.json","specs/subject-distillation/evidence-schemas/fresh-review.schema.json","specs/subject-distillation/evidence-schemas/migration.schema.json","specs/subject-distillation/evidence-schemas/review-result.schema.json","specs/subject-distillation/evidence/5dd83dd8b3d3696a/environment.json","specs/subject-distillation/implementation-progress.json","specs/subject-distillation/implementation-progress.schema.json","tests/test_subject_baseline_control.py","tests/test_subject_progress.py"],"artifact_kind":"subject-distillation-implementation-authorization-proof","authorization_id":"e5d4ca220016168b51af9035e5a6ef771d7046c9538d9a1c02fc8463c13a4c8e","authorization_pass_packet_sha256":"41b425df95381b82f45bfe094c8891273c484653af8aa80febf4ce693ba9b045","authorization_schema_sha256":"73ebc733f482a06b4ba77e507869597a2bc0b5e3ba6eca3ca969d7796d6170fe","authorization_verifier_sha256":"fd233f32a5f7afe506276fc92aae0d77a6144a0537e8b9b8f25cf300b22cdbe3","authorized_task":"T-001","authorizing_principal":"github:zycaskevin","baseline_full_digest":"5dd83dd8b3d3696ae4f33ac863af87f4baf569ac1ca5ea11014ad5919ae740e0","baseline_id":"5dd83dd8b3d3696a","expires_at_utc":"2026-08-11T07:58:10Z","implementation_base_commit":"git:24e1a126a1022a53480b7126f5f393dc0be85613","issued_at_utc":"2026-08-11T07:43:10Z","non_goals":["no.live.private.data","no.t002.plus.artifact","no_product_runtime","no_production_migration"],"owner_confirmation_ref":"owner-confirmation:76b1421de68dec4ca489fac52d03687bd6f52e21b32f7df22fe4f041a78cb215","prohibited_operations":["deploy","live_private_data","migration","non_github_remote_network","product_runtime","release","unreviewed_git_delivery"],"proposal_id":"76b1421de68dec4ca489fac52d03687bd6f52e21b32f7df22fe4f041a78cb215","receipt_sha256":"a10e3c77ad0201685a2ae4f5553900199bbe95879f95d56818144b36895a7821","recorded_at_utc":"2026-08-11T07:46:00Z","runner":{"path":"scripts/run_subject_implementation_authorization.py","sha256":"51ebcc00958c77d07cb7249070b91c17b5bb25fa6ed4737379514c7aa01db2c9"},"schema_version":1,"scope_sha256":"0cf58ed5378c3ed35fb60f80e198fb90dc27ba8a686585e4102083ca011c751d","status":"PASS"},"normative_hashes":[{"path":"specs/subject-distillation/requirements.md","sha256":"54adcfaef019e3b66d3cdc3db3bd5050b640c12c11a9c3265cb9d2d258913913"},{"path":"specs/subject-distillation/design.md","sha256":"6a304377d3e75d7f54f7bc866bb6df0600f57b77da0d1590f3b7b82e64ba7d23"},{"path":"specs/subject-distillation/tasks.md","sha256":"1dc2c8d9745e79788b5eef6131eebfd87c1bf70bc1aae0485ab304a5a72352fc"},{"path":"specs/subject-distillation/traceability.md","sha256":"664b56e264cb0df04fe33c3a0f27b35b17b45c7dfae8435095833b97205a720d"},{"path":"specs/subject-distillation/schema.v15.sql","sha256":"021a3dd72411f6c6ae05086c12ec270555f4ae797539b38ba027c3124d145fca"}],"producer_task":"T-001","python":{"implementation":"CPython","version":[3,14,3]},"schema_contract_version":14,"schema_version":1,"source_commit":"git:24e1a126a1022a53480b7126f5f393dc0be85613","sqlite":{"version":[3,53,4]}}
