{"artifact_kind":"subject-distillation-environment","baseline_id":"0dc10cfc4a429662","created_at_utc":"2026-08-11T11:21:56Z","git_status":{"captured_phase":"pre_implementation","clean":true,"head_kind":"detached"},"implementation_authorization":{"allowed_repo_relative_paths":["scripts/read_subject_baseline_id.py","scripts/update_subject_progress.py","scripts/validate_subject_evidence.py","scripts/validate_subject_progress.py","specs/subject-distillation/.implementation-progress.pending","specs/subject-distillation/evidence-schemas/attestation.schema.json","specs/subject-distillation/evidence-schemas/backup-restore.schema.json","specs/subject-distillation/evidence-schemas/environment.schema.json","specs/subject-distillation/evidence-schemas/fresh-review.schema.json","specs/subject-distillation/evidence-schemas/migration.schema.json","specs/subject-distillation/evidence-schemas/review-result.schema.json","specs/subject-distillation/evidence/0dc10cfc4a429662/environment.json","specs/subject-distillation/implementation-progress.json","specs/subject-distillation/implementation-progress.schema.json","tests/test_subject_baseline_control.py","tests/test_subject_progress.py"],"artifact_kind":"subject-distillation-implementation-authorization-proof","authorization_id":"468179c29ee4c98c59a973f81df73a1c173f95bcf9e793ce1cdbe29008e2e934","authorization_pass_packet_sha256":"bf52472108ea9a9ee8ce973d465dda0d5f73e15f4890ebf5223d78b6bc4391f8","authorization_schema_sha256":"73ebc733f482a06b4ba77e507869597a2bc0b5e3ba6eca3ca969d7796d6170fe","authorization_verifier_sha256":"fd233f32a5f7afe506276fc92aae0d77a6144a0537e8b9b8f25cf300b22cdbe3","authorized_task":"T-001","authorizing_principal":"github:zycaskevin","baseline_full_digest":"0dc10cfc4a429662037f3bb7d6c42e10e7cc832b540f7aa8f4b9e0656e0e459b","baseline_id":"0dc10cfc4a429662","expires_at_utc":"2026-08-11T11:34:34Z","implementation_base_commit":"git:1eb4d0ef7209cf3f04c5d163561403e835311aeb","issued_at_utc":"2026-08-11T11:19:34Z","non_goals":["no.live.private.data","no.t002.plus.artifact","no_product_runtime","no_production_migration"],"owner_confirmation_ref":"owner-confirmation:984f1c4f82b814798cbafbd119fc9f53398cf44a53d69639b557fc952530a4d4","prohibited_operations":["deploy","live_private_data","migration","non_github_remote_network","product_runtime","release","unreviewed_git_delivery"],"proposal_id":"984f1c4f82b814798cbafbd119fc9f53398cf44a53d69639b557fc952530a4d4","receipt_sha256":"d944d278dcfd79ce7451d8c747ec471459c8aacf730544c477b4f52363d1d29a","recorded_at_utc":"2026-08-11T11:21:56Z","runner":{"path":"scripts/run_subject_implementation_authorization.py","sha256":"51ebcc00958c77d07cb7249070b91c17b5bb25fa6ed4737379514c7aa01db2c9"},"schema_version":1,"scope_sha256":"d3defa9efac9d846d6252e587b70d9def11e283ce821fc9d21471d40e57e96de","status":"PASS"},"normative_hashes":[{"path":"specs/subject-distillation/requirements.md","sha256":"11f9dfc66f8cf0aa48d7fbddbba6509c4116ecf66248d1e87d0a111acf96d8f6"},{"path":"specs/subject-distillation/design.md","sha256":"3127c8323bb43f09fef1fb70d036c4efc786887431de8256e9783bee484b20fa"},{"path":"specs/subject-distillation/tasks.md","sha256":"0150935a1a16e51dc30dff9dff8d01104d7127ee3cf57333caec7586d93f5007"},{"path":"specs/subject-distillation/traceability.md","sha256":"664b56e264cb0df04fe33c3a0f27b35b17b45c7dfae8435095833b97205a720d"},{"path":"specs/subject-distillation/schema.v15.sql","sha256":"021a3dd72411f6c6ae05086c12ec270555f4ae797539b38ba027c3124d145fca"}],"producer_task":"T-001","python":{"implementation":"CPython","version":[3,14,3]},"schema_contract_version":14,"schema_version":1,"source_commit":"git:1eb4d0ef7209cf3f04c5d163561403e835311aeb","sqlite":{"version":[3,53,4]}}
